label,text
negative,agree the poor in india are treated badly their poors seek a living in singapore and are treated like citizens they are given free medical treatment given food daily sim cards to call home to tell their family that they are fine if covid 19 case treated foc in hospitals
positive,if only i could have spent the with this cutie vc sakshi__s i n g h coast crossing republik …
positive,will nature conservation remain a priority in post corona bangladesh | the daily star
negative,"coronavirus disappearing in italy show this to ""intellectuals"" who say lockdowns do not work …"
negative,uk records lowest daily virus death toll since start of lockdown govt
negative,joe biden's coronavirus web address lands on a donation page for his campaign he is profiting from fear demopos
negative,respected sir in our telangana all private teachers and lecturers are in horrible situations due to covid 19 and mainly private management (chaithanya nd narayana) b'caz they told to all faculty's like “no work no pay “ so pls take the action nd save their life's
negative,so is also 20 times more lethal than influenza think about that
negative,thull is passing the most dangerous and ultra hazardous situation in its history 80% population of thul town and surrounding have been striked by corona virus cm/health m sindh to take notice we plead the govt to pay attention to thul retweet &share
negative,thull is passing the most dangerous and ultra hazardous situation in its history 80% population of thul town and surrounding have been striked by corona virus cm/health m sindh to take notice we plead the govt to pay attention to thul retweet&share
negative,coronavirus has a 3 4% mortality rate the flu is 0 1% they are completely different your logic is like saying a bugatti and a peugeot are the same thing because they are both ‘cars'
positive,| is officially free city and the celebration goes on
negative,what worries me most these days me and a lot other people is now on the matter i'd like to say only that the drastic division among ourselves is the only reason why as a species (the only smart one someone thinks) in the universe mind you 1/5
negative,… i do not understand the point of demanding enough time before lockdown italy has suffered because of half hearted attempts and so is us now pm being the highest decision making authority has to take the decision
negative,you all know one thing the muslims will not fight us for the toilet paper
negative,covid 19 cyclones earthquakes riots still we humans have not learnt a simple lesson to live and let live when we cannot let live then we do not have the right right to live let god destroy this evil world this proved again that not to believe humans loudly_crying_face
negative,i will fill my heart to your soul during covid 19 break out on the world
negative,maybe if i bolt my front door shut coronavirus will stay out
negative,may be a solution to corona virus get some of that on you and no one will come around
negative,here are 13 claims has made about coronavirus that have already been disputed # xmbvwlnwqes twitter …
negative,phew i was sooo worried with the shortage of tests available for the general public i was worried about our sports celebrities not being properly cared for but thank goodness am i right
positive,they will not spread …
negative,idiot no comparison with obama's response according to ronald klain obama administration tested 1 million people for h1n1 in the first month after the first us diagnosed case the first us case was 50+ days ago and you have not event tested 10 000 people yet
negative,state governors decide when their schls & businesses can reopen (not the wh) without universal frequent testing we cannot isolate the infected we cannot stop the spread of pls call ur governor asap keep ur community safe usa
positive,finally accepts thanks to godi media
positive,two weeks ago i celebrated my birthday with a picnic on the beach ten days into lockdown here in goa and this feels like a very long time ago … …
negative,las vegas trip booked fuck the coronavirus
positive,good morning twittizens wish you a corona free day
positive,how ted ed is helping families students and teachers navigate the covid 19 pandemic … via – at madurai índia
negative,there is no injections for handle girls do not trust your bfs
negative,all sides must stop the carnage and work to protect citizens from conflict and covid19 threat by declaring ceasefire
negative,coronavirus countries enforce mass closures to stem spread
negative,they are habitual liars and constantly hiding the facts about corona death till just to save its plastic business
negative,some idiot is commenting on all city of vancouver posts telling people to sit in a sauna and not worry about can we please get rid of these people spreading harmful propaganda
negative,these issues can be exposed later already modi government has done nothing against coronavirus god will determine & punish them for they responsibility right now need of togetherness is needed for fight against virus government should use experience of senior leaders of our party …
positive,̇d19 alexgabyfan my baby trying to navigate to watch gaby and alex (top kids show) listen carefully she was trying to tell …
positive,hardship of lockdown comes with the ease of blessing that allah has brought family member together with my son asim town punjab pakistan
negative,no that is what you are talking about for some reason the topic of this conversation is delaying the primaries due to the coronavirus outbreak you are ignoring the pandemic very irresponsible
negative,threat assessment for march 9th back in black
negative,norwegian cruise line managers told sales staff to lie to customers about coronavirus via
negative,2020 covid 19 coronavirus us cases 580 us deaths 100 panic level mass hysteria 2009 h1n1 virus us cases 60 8 million us deaths 12 469 panic level chill
negative,your masturbatory ego rallies put your magats at risk but you do not really care do you
negative,because of covid 19 guidelines restricting visitation to hospitals and care centers john could not see his father in person before he died now he is asking members of his community to donate ipads that will be distributed to local medical centers
negative,worthwhile read pass the information along we have got to look out for each other the government has failed us on a disturbing level
positive,hoping that i would emerge on the other side of this more healthy and fit here's my dinner salad twitter com/iozlyen8rz
negative,give it a break rob this constant haranguing is doing nothing but dragging down people who need to have their spirits picked up save the politicizing for when this crisis is over
negative,what would be the situation if raga was pm entire world would laugh at us instead india leading the covid fight …
negative,was planning on making chicken noodle soup tonight but apparently all of the grocery stores in my city are empty this is fucking ridiculous i just wanted to make tonight's meal while ppl are selfishly stocking up on food they probably do not need smh
negative,coronavirus death rate mi blocked rate gong at same rate
negative,he wants to convey modi govt revoked article 370 as a result facing 370 cases of corona virus how sick
negative,coronavirus could hit housing hard as australia teeters on edge of recession the guardian
negative,i know everyone is panicking over the coronavirus but i just met my mum's new boyfriend and the first thing i said to him was “oh my god you are much taller than i thought if you break my mum's heart it is going to be much harder to kill you” and no one laughed
negative,government it is extremely week and pd (ex communists) are dictating the globalist agenda troika it is on the way and we are under oms leading situation we need to breakout euro prison asap with eu will decay that is why they are killing italy now
negative,19 the us leads the world in confirmed deaths
negative,yes and people fighting with hunger and poverty r also less vulnerable to …
negative,florida niggas will live forever we dont give a fuck about no corona virus
negative,corona cases continue to rise sindh chief minister syed murad ali shah increased lockdown in sindh till april 14
negative,hackers use fake coronavirus maps to infect visitors with malware via
negative,do not be deluded by the delay in your punishment when it comes it will be painful and severe _19
negative,so you no longer think that the coronavirus is a hoax perpetrated by the democrats exactly when was your epiphany moment
negative,we extend our deepest condolences to the somali people and especially to his family through the tragic death of honor nur hassan hussein (nur adde) the former prime minister of the country who died in london suffering from the deadly disease _19 pic twitter com/ia0nkyi8kg
negative,[ your life do not get better by chance its get better by change ] have you been affected by covid 19 crisis round_pushpin a pay cut by your company round_pushpin working extremely hard while managing your children at home…
negative,pinche coronavirus arruina todo
positive,israel offers to teach its secrets against coronavirus abroad …
negative,indian politics is more fatal than at this time of crisis instead of joining hands together to fight the virus our politicians are busy in blame game the migrants of other states are not voters and hence unwanted in their states shameless
positive,brothers day 69 of lockdown from the archives of 2015 majnu ka tila (i'm normally lazy when it comes to archiving my photos and also the daily grind hinders the process but this lockdown boredom has given… …
negative,toh aapne kya kiya 60 years me do not blame the current govt to hide your failures and incompetencies thanks to pm and the whole team for leading the world from front to combat covid 19 india is doing best in the world
negative,life is hard it is harder if you are stupid twitter com/39baeoupeh – at sivasagar town
negative,with the third highest number of coronavirus cases and second highest official death toll in southeast asia the philippines also allowed the reopening of more businesses and people can now leave home without government permits
negative,lockdown khatam hone k baad loog ye status upload karenge missing lockdown face_with_tears_of_joy face_with_tears_of_joy
negative,why healthy asymptomatic covid 19 patients are dying at home in karachi
negative,this time it is about indian economy after the covid19 pandemic pls watch comment and share …
negative,the orange haired orangutan said last week that fear was fake news from democrats and it will be over in a few days it is just like flu he said now the idiot says it is a what changed moron
negative,why you call shoab jamahai in debate he is a known islamist extremist he spread oral corona on tv he misused media for his said agenda of hate among society & govt of india defend his antinationals act in shaheen bagh
negative,i bet the idiot gb being is very concerned over the coronavirus not because of the health of their followers but because of the hit their bank account is going to take if meetings and assemblies are canceled this is a worse case scenario for them
positive,illustration _mack _19 …
negative,indian railways trains resume on tuesday the world's largest lockdown involved shutting the network which carried 20m passengers/day now there will be face shields for passengers
negative,why do u call idiots olike nishant verma on the show we will be compelled to stop watching i wish him corona
negative,'better a terrible end than endless terror' phrase
negative,766 people with symptoms have been admitted to hospitals across situation now under control cm
positive,glad to be part of a team that actually cares even in the times of lockdown jazz sent these care packages to its employees who are twitter com/t9rnujfum5
positive,naicee remix on yes let us break this lockdown together love from hugging_face hugging_face
positive,welcome to new life she fought well against covid 19
negative,adiaram a sleep se fude coronavírus
negative,all the churches kingdom halls synagogues that cancelled their services due to corona virus shame on you u should have faith that god has your backs & not worry to cancel services must mean u do not truly believe in god now u looking at science and you are scared of catching it
negative,when scare ends pic twitter com/jlbmdj9kcw
negative,bs why do you lie the chinese government notified who about the coronavirus on dec 31 the trump administration sprang into action less than a week later on jan 6 meanwhile all democrats did was to work on their next impeachment scheme the timeline proves you lie pic twitter com/sun60wsuym
negative,yes quite the rouges gallery on the presser today all they needed was up there with them i am sick of this shitshow do not let this crappy bunch of derelicts make you feel that this is normal it is not
negative,grocers struggle to keep sweet and salty snacks in stock as consumers look for comfort in cookies and chips amid growing coronavirus fears
negative,dude is it irrational to not want to go to the gym while their is a coronavirus outbreak asking if i'm being too anxious or lazy
negative,especially when he said you can go can go to work with coronavirus and when he said the “number” will be zero in the next week just admit that you prefer to remain ignorant
negative,it is heartbreaking(｡•́︿•̀｡) the coronavirus disaster leads to fear and loathing——ccp is too far away but chinese are among americans i suppose it is much easier to blame the accessible than the crafty＆unlikely to punish but please treat them better ( •̥́ ˍ •̀ू )
negative,for the 6th day in the last 7 we have had after america the highest daily death toll from covid19 in the entire world
negative,as we continue our lockdown remember that we will come back stronger and better as a nation road ahead is tough but we are tougher our forefathers build this nation with their blood and…
negative,*denmark shuts schools and universities after surge in coronavirus cases* denmark dk's prime minister is now announcing that most of denmark is shutting down schools and alot of institutions groups of more than 100 people is not allowed
negative,the thought of jacob's nashville show getting cancelled makes my heart hurt soooooo bad please go away
negative,wajid khan the popular bollywood music director from the sajid wajid duo passed away today at the age of 43 he was suffering from covid 19
positive,lockdown blessings
negative,so claims the is a hoax while italy quarantines 16 million people we all may be dead or broke before we get a chance to vote this idiot out of office in november
negative,grabbing bite at atl cashier took a text while serving me apparently lakeisha has coronavirus and will not be in none of us seemed to care we just wanted our stupid food
negative,will it go ahead with coronavirus threats
negative,do not let the coronavirus get you down burn one
negative,cannot you ask your old mates at the bbc they seem to know every bloody thing about coronavirus especially their so called correspondents they bang on about it every waking hour
negative,"""nothing justifies being rude to others"" and that goes for everything not just because of the coronavirus"
negative,and ⁦ are aiming to have thousands of americans die from covid 19 to stop pres trump from being re elected dems are evil sick people ⁩ fails to move forward with coronavirus 'phase 3' bill amid dems' opposition
positive,those who have been criticising doctors since the start of pandemic have good new home isolation policy is announced now you can take care of you asymptomatic patients i doubt how many will take care of their covid 19 positive relatives
positive,anyone is bellcome for this healthy cowdung sauna style bathwa only in hisar haryana bharat it will suckwa and killwa all the coronavirus
positive,"lockdown also made the people ""brave and strong"" about their family issues and relationships"
negative,i have been switching between al jazeera sky news bbc and cnn and frankly i am worried italy is in a terrible state hmmm we cannot afford to get to that point i pray we do not averagely that is what we do pray
negative,anthony causi beloved post sports photographer dies of coronavirus at 48 via
negative,covid 19 spread can be stopped only through the formula of social distancing without that the stage 3 of the virus is not much distant away from the india society _distancing
negative,"saying ""panic is not necessary"" is not helpful anytime anyone has told me to stop panic it just got worse"
negative,worried about do not just wash your hands – urge congress to pass a key prevention tool and commonsense protection all workers need even when we are not facing a pandemic
negative,i do not think the coronavirus realizes who it is messing with pic twitter com/llvkv4ne98
negative,messaging has been disgraceful of course it would help if people actually used their brain instead of walking around totally clueless
negative,most of the private hospital are charging 300 to 3500 per day for corona patients in mumbai and most of the the hospital dont have sufficient bed wt will happen with the peoples below poverty line
negative,coronavirus is screwed
negative,society does not care about me just because my face sucks and i have no control over it that is some bullshit and society is too shallow to even admit it at least corona virus is giving normies their just desserts
negative,here are some tips to preventing yourself from getting corona virus wash your damn hands shower and overall have hygiene it is not hard people
negative,immigration judges (naij) eoir has ordered immigration court staff to remove cdc posters designed to slow spread of coronavirus no this is not a parody account
negative,i know if anything it is a cold people do not realize it is also spring with allergies not corona virus i'm not letting them poke me with nothing regardless they may just be injecting you with something jmo
positive,taher shah's new song is out it will end corona virus in the world now
negative,nhs scotland shame on you we have a confirmed death due to the coronavirus in the highlands and are being refused information about where the individual was from allowing people the facts to enable informed decisions is only fair treat this as an foi
negative,i rlly got to move out of college bc of coronavirus this shits crazyyy
negative,"death toll in italy surpasses 7 500"" over 400 patients 100 people recovered 200 dead globally"
negative,serious question for all who think this whole thing is overreaction and hysteria do you actually believe nearly every nation on earth would shut down their entire economies over a “cold” or is it possible this is worse than they are telling us to prevent panic
negative,do not know who this guy is but he has a great point kween hillary would be handling this crisis like a champ if she were president she did such a great job managing bill in the oval office we would really be going places if she was in charge sad
negative,capitalism (and the greed it breeds) is probably going to make the spread of even worse in the us
negative,this pc is a joke on those people who are suffering from _19india …
negative,hm this corona virus is getting serious chale @ dansoman
negative,just in public areas of buildings owned by in and around temple square in downtown slc have been closed until further notice due to concerns over the novel
negative,you know who will be unaffected by the coronavirus the most deplorable of deplorables they will not get sick
negative,“hahaha look everyone he shit himself ” nonono i swear i have coronavirus
negative,stigmabase — hong kong protesters have promised a 'miracle' but china's national security law seems after a months long break due to the coronavirus pandemic sunday's march was the first opportunity many hong kongers had to view article
negative,is the making you afraid of what the future holds looking for a sense of peace call 877 whyislam you deserve to know
negative,do not underestimate the coronavirus i repeat do not underestimate the coronavirus it has evolved to not only infect animals but also humans dont think it is dangerous cause it cannot kill you yet if we do not stop it covid 19 will continue to evolve to potentially become deadly
negative,wall street roared back to life on tuesday rebounding from the brink of bear market confirmation as bargain hunting and hopes of government stimulus calmed investors' fears surrounding the and growing signs of imminent recession
negative,the christian right and are the biggest threat to the world right now during this pandemic they outright evil their ignorance is death incarnate
negative,dude on the train dressed like kakashi telling me “it's coronavirus safety not cosplay” he better kamui that mf then cuz his nike mask not doing shit
negative,let me tell you all this is the only trick of china to defeat america because they cannot come to the fore and fight america so they resorted to this corona virus and the whole world is suffering
positive,my dearest mate it is been a real pleasure to have u i've not seen u personally but you are 1of those human beings who has a virtual presence in theloyalty i really love you respect you trust you be safe & if possible plz keep me posted regarding ur status pic twitter com/go071yuet0
negative,really feeling bad is this the arrangements for unlock 1 really as we are having more than 3300 cases in the sole indore then too then arrangement are like this really feel bad /d5dvnyakjc
negative,"coronavirus captain smith and pocahontas had a very mad affair when her daddy tried to kill him she said ""daddy oh do not you dare"" he gives me fever with his kisses fever when he holds me tight fever i'm his missus so daddy will not you treat him right"
negative,covid19 kills another event as dolpa43 becomes 100% online
negative,the world today is just like 2000 we were warned about the millennium bug a potential technological problem what did people panic buy condoms coronavirus now panic buying loo roll think with our genitals for 2000 think out of arse today
negative,i know govt is trying to get the economy back on track&minimize d loss but that does not mean you give instructions to resume the train & flight bookings lockdown must increase to safeguard the lives of people life comes before money
positive,i hope you are all doing good in your quarantine stay home stay safe not only from but also be aware of the dangers of so use mortein products and say
negative,this is our so called muslim society where a muslim women officer harassed by these shitts mard enko lagta hai ye musilman hai jummah par kr aye hai musilman hai no mein enko musilman ni janta touch her they abused her physical ridiculous __19
positive,_board you & tejaswini both are doing a commendable job with special focus on board segment children though we got to know about you only during the lockdown have recommended your youtube video clips to many please continue with the good work & all the best
negative,finally ovrtook fr destruction vdout cause undr ego policy r dffrnt sides of d same coin unlike der past & presnt charactr dey considr demslves superior to rst r careless fr _19india undr ugly thinktheory
negative,probably going to take a mass shooting for people to shut up about the coronavirus for a few days
negative,if i were ever faced with the prospect of licking a toilet seat where a thousand strange butts have sat coronavirus would be the last thing on my mind afterward i would hope for a fast acting strain of the disease to finish me off
positive,due to one set of people some country utilising opportunity and make fun of entire community thing
negative,so says nothing to worry about with the corona virus & then he works from home pulls his kids out of school & tells all other politicains to go into isolation some fucking leader
negative,due to and in bowenpally area there are a lot of people's are not having a single rupee to buy a rice and there in need of ration for their homes so please come out and help those people by feeding contact me 7799322774
negative,rest in peace celebrated music composer of the duo sajid wajid passes away at 42 he was suffering from covid 19 pic twitter com/u4s0rtwlst
positive,day raised_hand_light_skin_tone victory_hand_light_skin_tone victory_hand_light_skin_tone globe_showing_Asia-Australia
negative,all these super fit athletes testing positive for and here's me just lazing about fat as fuck severely unfit asthmatic full of anxiety does not believe in fruit or veg and a drug taking binge drinker what chance have i got come at me
negative,it will take 25 years to test 20% of the uk population at the rate they are being tested for people are waiting on tests this is unacceptable and dangerous
negative,fuck u coronavirus i cant hang out with any of my friends now and i have to sit by myself and think key word think thinking is not good cor my health
negative,pls issue 2 beds for my parents in saket my parents are covid patients they need your help 30% beds r reserved for covid patients i request you to please help us my parents are diabities and hyper tension patients
negative,the idiot's guide to coronavirus from an emergency physician via
negative,hey do not email me about the coronavirus worry about my money and that is it you can cut the shit as well
negative,i think it is time to replenish or add more weapons in my inventory regarding with this corona virus we are facing i will not be left defenseless in my own home if shit were to go down fuck that
