label,text
positive,taking thermal checks using temperature scanners & making use of masks mandatory in this way people can stay healthy during the lockdown
positive,good evening sir my self nishant solanki i have vaccine for coronavirus but it is not sure so plss read this
negative,alcohol consumption worsens the prognosis of corona virus
negative,why are you lying on the deaths of covid patients twitter com/kcfgdftcgh
negative,a day after a 45 year old man from shopian district died at skims soura his swap sample returned positive for the novel coronavirus on monday taking the death toll due to the dreaded disease in to 29
negative,you should be shame because we have got saudi medical doctor working in your country with no charge to your government helping your country on corona viruses we should be thankful not been attacked by you
negative,i've consumed enough raw cookie dough to worry about coronavirus salmonella couldnt take me and neither can you
negative,it is just the most pathetic lowlife cannot believe he will not bring himself to encourage rather than tear everyone down during this very challenging crisis sad very sad
positive,lockdown wala happy birthday big b grinning_face_with_sweat heavy_heart_exclamation confetti_ball party_popper birthday_cake rose
positive,yes why he always talking about yoga because he knows only north covid 19 not known medicinal not known current situation of the world ithink tamil nadu cm is better than pm
positive,yknow during this covid i can finally see my own local people on our public transports
positive,ncc meets today as covid 19 situation worsens
negative,if the public's response to teaches us anything it is that we are never going to get rid of racism sexism bigotry xenophobia etc because people in general do not give a shit about each other not a single fuck
negative,the word ‘corona virus' is actually starting to hurt my head
positive,april may edition of #लोक_कल्याण_सेतु highlights easy tips to prevent corona measures to get rid of bad effects of eclipse benefits of meditating on the idol of sadguru simple ways to stay healthy the festival of gaining devotion n wisdom guru purnima pic twitter com/sl3ervpnqk
negative,great spread panic across the world i'm currently in wheelchair i find it difficult to get around i do not have money now till next week 30 march uk government needs to allow us to get weekly esa rather than fortnightly during i cannot get food till then
negative,in a year dave will be one laughing or deal gets busted he goes back to running bs and penn stock recovers
positive,backhand_index_pointing_right face_with_monocle special thanks to mr gyem tshering ( phd student from bioclinical sciences program ) for designing this knowledgeable infographic to our community laptop_computer mobile_phone fb messenger
positive,sunset stop motion captured by me using app sun
negative,preach i get that we all want to be safe for the coronavirus and that means we have to give up hugging it literally fucking sucks but it just does not make it fair for her to hug people outside the venue for free but not for people who paid $275 vip
negative,today at 02 30pm a 54 year old bangladeshi male admitted at tree top hospital has passed away this is the 6th covid 19 death in the maldives our thoughts and prayers are with the bereaved family may allah grant his soul eternal peace in heaven hpa
negative,ktr sir please keep mercy on physically handicapped sir i am a physically handicapped recently i lost my private job in this lockdown period i am facing very panic situation plz kindly give me any contact/outsourcing …
negative,help me 's ali khan i'm in tension in this year corona effect help me please 't ignore me crying_face crying_face loudly_crying_face loudly_crying_face folded_hands folded_hands i'm from this my no 7287862345 and my google no 798939118
negative,the coronavirus homie really just tried to pull up on me like this nigga is not sick as fuck right now
negative,coronavirus this is a war but it is unlike any we have seen the australian
negative,as the coronavirus situation worsens every day some serious restrictions will be applied shortly there is a chance that all travel between europe and the read more
negative,congratulations mr yeshwant sinha for working hard to see that the coronavirus spread fast in india so that you can bring bad name to modijee if we have people like you we do not need enemies you are worst than coronavirus if you see snake and yeshwant kill yeshwant first
positive,sir great analysis on coronavirus and coming of messiah
positive,congratulation hariom and thanks ji for great examples of social distance in lockdown period of madhyapradesh pic twitter com/nt0jimpyb7
negative,afghans think that drinking green tea and burning esfaand will cure coronavirus
positive,from red_heart saptak news a lockdown music video by and team releasing soon
negative,shelby county schools to be cancelled starting friday march 13 through march 30 due to coronavirus concerns
negative,the coronavirus memes crack me up lmao
negative,the handicraft sector is one of the worst hit sectors due to this lockdown many skilled artisans are struggling to make ends meet your support will go a long way please consider purchasing handmade products for… …
negative,but i have heard that doctor osman had brain haemorrhage not corona
positive,quarantine day 7 lunch when loved ones share food during the quarantine ) thank you tanvi aditi & ekta … …
negative,maybe i'm ignorant to the whole thing but the coronavirus is the least if my worries
negative,my white blood cells coming together to attack the coronavirus my los blancos twitter com/poc1e3r7yw
negative,is your coronavirus fear and outrage only due to your individual risk your loved ones strangers millions of people die unnecessarily around the world annually and while their risks may not be yours or universal their lives still matter this is public health
negative,this viral coronavirus rant from a tennessee nurse will make your day (video) via
negative,ma'am kindly consider this problem it is a humble request we are facing double side effects one is sallery issue and other is corona virus
negative,rip death reason age wajid khan the popular bollywood music director from the sajid wajid duo passed away today at the age of 43 he was suffering from covid 19 rip pic twitter com/b997ti0say
positive,nostalgia nut not for long face_with_tears_of_joy had a really great time victory_hand these guys are the major missing in this lockdown love you guys heart_with_ribbon – at vip road
negative,once again gave republicans everything they wanted in the bad coronavirus bill just like in 2009 most of the bill is a corporate bailout with very little to workers i agree with democrats are corporate socialist
negative,currently pakistan is confronting three major challenges 1 corona virus 2 ignorance 3 fake news
negative,i overslept and missed 2 online classes and that is on covid 19
positive,interview4 voa on impact of covid 19 on natural environment the pandemic a disaster to mankind but a blessing for other living beings on earth the link of the programme will be shared once it is ready and uploaded twitter com/adcugraohh
negative,this is what lockdown shows up on 31 dec 2020 no one have the fear parents are not worried of there childred hope for there wellness in future sector 7 colonly palces police should give a round after 2 for 4 hr standing on streets will not work out pic twitter com/j9q6vjgug9 – at sector 6 bahadurgarh
negative,"divine soul belgian woman suzanne hoylaerts aged 90 dies of _19 after refusing a respirator telling her doctors ""save it for the youngest [who need it most] i've already had a beautiful life "" may her nobel soul always rest in peace twitter com/4nnkqzn2ui"
negative,important day today for decisions and way forward ìn sir chairing the meeting of 1 epi curve chart 2 short term anti covid strategy (pre ncc discussion) 3 ban or otherwise on export of rice in view of locust threat / food security pic twitter com/ty674oorxz
positive,lockdown me baal tw lambay hoa va hnn ab ye wala haircut krwao ga after lockdown man_getting_haircut_light_skin_tone OK_hand
negative,ca in alliance with disney corp has decided to keep their themeparks open during this pandemic ca has created a petri dish to export coronavirus to the rest of the country please stop ca stop the madness
positive,wfh w on top *whisky pic twitter com/8dwiodzxto
positive,no excuses please of my lockdown countdown … …
negative,nizamuddin masjid maulana's are blaming on and for the lockdown this maulana's should be encounter on middle of the road you fools are still doing politics in this salo mullahs tumko toh bhaga bhaga ke marna chaeye
negative,wearing mask and stay away and following the instructions of govt is the only way to cure
negative,now missing posters of bjp mp shri partap sarangi are up across balasore loksabha in odisha partap sarangi has been missing from his constituency throughout lockdown while posing with pm modi during his aerial… …
negative,covid 19 africa 6 075 cases on the african continent 214 deaths & 478 recoveries |
positive,while the rna of the was found in tiny droplets in scientists do not know if it was capable of transmitting the virus
positive,my life is a fine breakfast a flat lunch and a miserable dinner duck and potato filled up twitter com/rghav9prfu – at fun island resort
negative,if the coronavirus was a sign it is definitely a scorpio
negative,communication blockade amidst a pandemic and nobody cares humanity is dead i suppose this world deserves much worse than covid 19 middle_finger_light_skin_tone
negative,die verantwortlichen des coronavirus covid 19 biologische waffenforschung werden die verursacher dieser historischen pandemie einfach so davonkommen what is with the causer of covid 19 it is the greatest crime against humanity the perpetrators must be brought to justice pic twitter com/lu2uxogxlu
negative,stephen colbert's bathtub monologue ruined coronavirus' only silver lining
negative,is this humor people are going to die from the corona virus you are a senator a supposed leader what is wrong with you
positive,"gift institute ahmedabad ""due to covid 19 lockdown for longer period is becomes important & serious needs to systemize more our syllabus course abstract content means more productive then less practical &… …pic twitter com/llg2ycnbk"
positive,big up and thank you to participated to this challenge you killed it you are amazing musical_notes corona dance popaulamisi & bmkiller_mobutubeat…
negative,you got rejected in your own home state sit this one out
negative,utc 7 | in — severe lockdown curbs may cause more deaths than coronavirus expert tells rahul gandhi “india would ruin its economy if it has a very severe lockdown ” professor giesecke said adding do not ignore pregnant women health ministry …
positive,it is important to keep the physical and mental health of our covid warriors good & strong it is a long war that all of us are fighting and they are the forefront something like this will really help them in dealing with the stressful time great initiative
negative,so there is a potential cure for coronavirus and the news jumps back on the climate crisis train in no te
positive,yes and this lockdown has made me appreciate the park so much more than i used to
negative,we can i'm just not going to stream tonight i am sick no coronavirus tho but we can definitely play
negative,coronavirus india china face off uk plans to form 'd10' pakistan plane crash canadian air force jet crash hong kong protests cyclone amphan michigan flooding us ends relationship with who nasa spacex launch killing of george floyd us protests
negative,watch coronavirus awarness eps01 facebook live only on young hindu democrats of pakistan speaker dr fizzah qamar when 08 00pm sharp today 9th april 2020 facebook page
positive,it is requested to all citizens to help india to get freedom from covid 19 by simple step peep to your right and left and if you see any body roaming without mask in your locality kindly remind him/ her to do so thank you
negative,treasury secretary warns us could see 20% unemployment rate due to coronavirus source says thanks for this health crisis it is upon you&only you & your admin for what the devastating impacts of your inaction on
negative,i've been out of it all day head hurts and stomach feels like shit and no i do not have the corona virus just feeling weird
negative,you still think this is about money dude the underlying issue is you lying all the time so there is a lack of trust and the lack of tests for sick people do not shop nor do they buy stocks or pay into their 401ks
positive,the best solution is an orderly and humane repatriation home and arrangements for food and wages during the lockdown these are our fellow citizens too please help them
positive,it is nice to see families up on the terraces of their homes walking talking interacting flying kites they are going to miss this once this is over hopefully this will bring and a long lasting positive social change twitter com/5rpf51frkj
positive,we are proud of shri himanta biswa sarma sir we are blessed to have you in between us in this unprecedented crisis how pm narendra modi's northeast warrior himanta biswa sarma fights coronavirus india news …
negative,"a vendor from china emailed me today offering lots of items (sanitizers face shields protective clothing) for if needed and i've got adding tariffs and calling it the ""chinese virus"" on this end"
negative,new of ncr 400 cases in last three days 48 cases reported today morning twitter com/uzzhcvwvso
negative,25 year old up's 1st coronavirus death it turns out many at 2 hospitals were exposed ndtv …
positive,stars of viral pandemic movie contagion reunite to offer coronavirus advice
negative,how did a home economics teacher become so corrupt/dirty crooked infusion of filthy money will do it every time right to not vote to help families in tennessee with coronavirus is beyond evil yours is coming lady
negative,please stop pushing the mortality argument it is not about the deaths (although those octogenarian victims are someone is loved ones) it is about the infectiousness down time and the disruptions to the routine (as well as the potential strain on the healthcare system)
negative,whatever pain i feel i google if the symptoms are related
negative,wajid khan the popular bollywood music director from the sajid wajid duo passed away today at the age of 43 he was suffering from covid19 rest in peace wajid khan twitter com/csls7m9dhj
negative,the big question is where and when did arteta got infected with the corona virus is the arsenal fc environment safe cannot there be a probability that arteta is not the only victim of this virus in arsenal
negative,"i hold you equally responsible to any tory voter for every single thing johnson does especially when the whole country is now at the mercy of his vicious psychopathic coronavirus ""strategy"" you wanted ""anyone but corbyn"" you have got it own it"
positive,boost immunity against corona /cr6o7ygfmh
negative,he knows if he tries to say coronavirus he will wind up saying something worse than covfefe
positive,corona virus family is present in felines nothin new
negative,my bf kisses me like he is scared to get corona virus jk i love him good day
negative,asymptomatic they can be sitting next to you
negative,john henry looks like mother theresa compared to this dickwad bruins owner jeremy jacobs shamefully has not pledged to help td garden workers during coronavirus out
negative,it is business as usual in the queens courts where coronavirus concerns will not get you out of jury duty
negative,french bread vienna sausage danish croissants german potato salad french dressing italian seasoning chinese coronavirus and leftist senate dipsh*ts it is all good and not racist but let us know how the no malarkey bussing goes for you wah what an offensive fraud
negative,i agree with you everybody loves to play self righteous police on social media what is next 'i will only watch movies featuring actresses who make sensitive comments about the coronavirus crisis' but i will still worship kobe no matter what he did in that hotel
negative,racism and xenophobia will not help us stop and calling it a “chinese virus” will not distract americans from how poorly this president is handling an ongoing pandemic twitter com/xgbj3pzz14
positive,i heartily thanks to sbi sme rudrapur which provided the covid relief funding to us it will help us in this though time i appreciate mr gaurav agarwal sir n rmme abhishek garg ji for excellent work
negative,is not no fucking coronavirus going to stop me from going on cute dates with my crush
negative,sen rand paul tests positive for coronavirus libs pile on hate
negative,the impacts of this shutdown will have a far greater negative impact to the country than coronavirus
negative,no contact tracing done if days back one patient in our icu came postive but there attendants were rooming freely in hospital need of hour do not mix covid with noncovid in term of staff as of time is done despite government order
positive,good news out of the ten covid19 patients in district gurugram 9 people have fully recovered
negative,what do you think about covid 19 how many days are needed to remove this from our live
negative,i've always been the type to need control and to know what is next this coronavirus shit really forcing me to take control of my anxiety and i'm doing a pretty good job
negative,please register fir against this fake doctor spreading misinformation on coronavirus and order youtube to block this account
positive,pavilion
negative,democrats are obstructing passage of a bipartisan relief bill
negative,oh no ( there is the second case of coronavirus on paraguay (
negative,earth 1 0 before covid 19 was so beautiful that i am now damn excitef to see earth 2 0 soon shot on ahmedabad baroda expeess highway just before covid 19 entered in india seriously 6th march 2020 shot on my… …
negative,kejriwal sahab yourself advertisement on almost all channel's using corona to bear request you to work on ground chief minister are also working on corona
negative,the us has tested fewer than 7 000 people thus far for are you kidding me are you kidding
positive,good news for bathinda twitter com/hkjz3kvmiu
negative,dallas is over here trying to set itself up as an alternate location for esports and coronavirus is shitting all over them
negative,very disappointed to see the volume of “you cant catch covid as its a virus” and all the come slithering to the surface if you cannot catch it please go and volunteer in a hospital for a day then isolate and stay home for 21 days good luck
negative,the idiot and both need to lock themselves in the same room and turn over running the country to the next person in line for potus until they can be defiantly cleared of the coronavirus they have both been exposed
negative,trump looked sick and was congested during the press conference spoke a few words and bounced hmmmmm
positive,when generation alpha put on headphone for my playlist be like stay at home keep it clean enjoy your music and be safe guys let us stop the covid 19 infection chain so we can go out and celebrate ramadan …
positive,today is april fools day but we are closed inside the house happy april fool day twitter com/rxgz9fu0km
negative,while karnataka is grappling with rampant corruption even while covid rages on the himachal pradesh bjp president resigned after he was found guilty for having involved in the ppe kit purchase scam pic twitter com/mumzgbe8ia
negative,having a 4 year old with sleep apnea is the most scary thing and now his operation is going to be cancelled next week
positive,you guys i posted a new video on youtube where i gave my advice on how i've stayed safe during two months of quarantine in wuhan link is in my bio ー19
positive,alumna making us proud during pandemic
negative,gh leaders will intentionally disgrace us you have this police truck that sprays hot water so cannot you use that for the coronavirus mass spraying wtf is that thing water pistol sef better pass am
positive,for the well being of mind and body amid the coronavirus lockdown pm modi encourages citizens to practice yoga through the ‘yoga with modi' series the clips are a series of 17 different asanas via namo app
negative,with khabib being stuck in russia due to travel ban connor will be sharing the octagon with tony ferguson at no one was expecting such a turn however the notorious going to lose this
negative,testing blunders crippled us response to coronavirus
negative,boris johnson grilled after warning over lack of coronavirus testing via
positive,a brazilian mother her son after he had to go out to buy for the ー19 _distancing
negative,very disappointed in senator cruz for adding to the hysteria of this with his self isolation just because you interacted with somebody who might have it does not necessarily mean they transferred it to you everybody stay calm we are going to be just fine
negative,corona is going to give many bad news
negative,negative result again for covid 19 and got cleared back to work tomorrow
negative,the difference is nationality is not visible race often is and that is why this name is harmful why do you think only right wing twatwaffles like trump use it the virus has a name it has two pick coronavirus and/or covid 19 and stop being a racist pervert
negative,first cases of in kyrgyzstan mauritius (république de maurice) new caledonia zambia djibouti & montserrat people are spreading this virus everywhere it is not going to spare any little island no big country no smaller no bigger no closer no remote place f***
negative,take healthy food say goodbye to corona virus( ) twitter com/aahq9ztn87
negative,have u seen the coronavirus porn plots lmfaooooo
negative,the fatalistic view from an er nurse on what is ahead with
positive,my was on 23 march before singapore went to a semi lockdown on 7 april we managed to sneek out for office lunch at pariaman and got a charcoal ice cream haji lane was quiet due to travel restrictions it was a fun day
positive,great work hon'ble sir highly appreciated thumbs_up thumbs_up _19
negative,i'm so annoyed yes the media over plays the coronavirus and a lot of people are severely overreacting but why is it bad to be vigilant and concerned for our health a lot of people live with suppressed immune systems chronic illnesses and live with grandparents
negative,rest in peace celebrated music composer of the duo sajid wajid passes away at 42 he was suffering from covid 19 pic twitter com/859yfslews
positive,going from strength to strength is covid 19 in gurgaon
positive,yesterday gallio science club jointly with vasavi club udumalpet we were distributed covid relief materials to isalthittu tribal village people pic twitter com/kjcwct6ied
negative,acty it is not relief for labour's since lockdown is almost over in many states if labour went to home town now then may die with hunger it is better to do stay wherever they are and work as they shortage of money
negative,the scams are starting pic twitter com/3a5ibjww7n
positive,‘nurses' join the covid 19 battle thank rss for help … via
negative,during the crisis when i think of leadership that will get us through this i think of 1st
negative,hey why are the republicans trying to sneak in abortion rights laws into the corona virus help bill very shady to be trying something like this in a crisis
negative,video shows in patients sleeping with dead bodies legislator nitesh n rane on wednesday tweet a stunning video purportedly showing covid 19 patients sleeping among the dead in a mumbai hospital
negative,taiwan says it warned who about coronavirus in december but its warnings were ignored via
negative,what streets look like during the two hour break of the total curfew mandated by the government swipe left for a closed eye image of myself zany_face face_with_tears_of_joy yacht club
negative,lawmaker retracts claim that idf sprays ' ' with 'unknown substance'
negative,give me only 5 lakhs not only i will destroy corona from our country but also by my formula not a single indian will be infected in future try once do not waste time on 2nd of feb i told to lock down whole nation 7th march i told 25% will be infected jai hind
negative,grand princess arrives in an anxious oakland now at the center of coronavirus fight los angeles times grand princess arrives in an anxious oakland now at the center of coronavirus fight los angeles timesabc news prime co… twitter com/ekessa9qfg
negative,coronavirus researcher calls it the 'most frightening disease i've ever encountered' |
positive,your favorite game read them just 2min …
positive,great work by salman khan keep helping our corona worriers …
negative,what is this happening to this lovely island disappointing please wake up teach them a lesson do not play with innocent people …
negative,wajid khan the popular bollywood music director from the sajid wajid duo passed away today at the age of 43 he was suffering from covid 19 twitter com/pohl4dxr89
negative,i'm going to lose it if coronavirus affects my summer trip to vegas
negative,australian researchers have just worked out how the body fights coronavirus
positive,"""earlier this month i took up a content creation project for a home stay in himachal pradesh to write about it i had to be there full story >> twitter com/4naqwphrmj"
negative,our chief instructs the ruling govt to take severe action regarding the overpricing charged by private hospitals for corona patients in the middle of a pandemic he even claims that govt has failed completely in implementing precautionary measures to handle this pandemic pic twitter com/sdvtpjghn6
