label,text
positive,today i feel kaashh “yogiji ” was our health minister chun chun k lete class
negative,russia reports few coronavirus cases but sharp spike in pneumonia — quartz what are you thinking about this
negative,heavy_minus_sign heavy_minus_sign play_button ︎ follow ( ) play_button ︎ follow ( ) heavy_minus_sign heavy_minus_sign …
positive,nothing feels more satisfying than witnessing a successful covid extubation when the patient has been intubated for more than 20 days it is the absolute best الحمدالله
positive,a mother cat bringing her baby to the hospital in her mouth the world is getting better at that moment beating_heart _19
positive,the volunteers of orphans foundation pakistan distributing food among families at mardan kpk to support the orphan and daily wagers unemployed as a result of coronavirus widespread jazakallah donor pic twitter com/qgqvm5o73a
negative,corona virus to my brain flushed_face
positive,‍ 18 nations including usa and uk wants narender modi as leader for task force for corona what a proud moment for india believe in him and india will win please support
negative,mission begin again together we can fight with the precautionary measure and following social distancing norms we can fight against corona twitter com/isqcfgqq0k
negative,when india is in lockdown we have more than lakhs of _19 cases then can you imagine what will happen after ending
negative,so it turns out i pissed off some conspiracy theorists who think coronavirus is a myth or exaggerated or something fuck them
negative,my guess sg wants to stream line inter state and intra state passengers as of now intra state passengers need not follow home quarantine or covid test but if intra and inter state mix up happens either all pax needs to be quarantined or all need to be tested impossible ri8
positive,i am also reciecing calls from for i have no clue how to cater everyone
negative,so sen burr screwed millions by lying about what he did was tell america the same things as so trump screwed millions too
negative,being quarantined w my roommate pros free weed free alcohol cooks a lot of good food has cute dog is generally p chill cons keeps inviting ppl over & we definitely both have coronavirus at this point
negative,people attaching the media for fear mongering over coronavirus are fucking morons what is wrong with you people
negative,usa still beleives in playing blme game when it comes to covid19 they are inquiring how china couldnt just contain it rather than acting and saving lives of many americans man_shrugging_light_skin_tone
positive,stay home stay healthy stop spread love and save humanity ー19 _19sapic twitter com/rhy9x8wdbd
negative,coronavirus is no runny nose & dry cough u gooood
positive,initial lockdown actually helped masses coming in direct contact with people returning home from abroad or with their close accomplices two thousand zamaties infected about sixty thousand others secondly it accustomed us to social distancing & wearing masks
negative,black hat hackers are adding to the paranoia
negative,now people will not die of hunger they will die of _19 please follow and encourage stay at home
positive,thank you and this might be the best way to wish you women's day on this beautiful occasion congrats on birth of your second child ) loads of love for you naahi nazaan and the lovely mother ) looking forward to ease this lockdown and visit you
negative,asymptomatic people without coronavirus symptoms might be driving the spread more than we realized cnn
negative,you continue to disgust me with your partisan politics really you attempted to insert abortion funding into the covid _19 corona virus relief bill you are what is wrong with d c not trump you
negative,the corona virus is bad but the rampant out break of fuckwitism is coming a close second
negative,xi jinping's coronavirus body of lies
negative,sir we are the people who belongs to lower middle class there is nothing in the package announced by you for us during this corona
negative,estonia to bar foreign travellers from entering the country from march 17 to stop spread of coronavirus government statement
negative,this coronavirus affecting my plans a bit too much now ffs
negative,indian govt should follow uae model for punishment to the people not following corona guide lines
positive,happy ramadan everyone dizzy may this ramadan brings peace and happiness and make the world corona free and safe again ameen
negative,"watch & listen live daniel whyte iii preaches the ""onward christian soldiers discipleship class envy"" rt and invite your family friends & followers to join us pic twitter com/o7gfngmair"
negative,have you ever put your car in reverse and just smashed the bumper into smithereens and just kept on driving
negative,apparently the complete lockdown on weekends will continue for 1 month
negative,"sir oath tell us "" first do no harm to patient"" u seems to b very well read how this corona is spreading so if u do not give ppe to the medical staff handling corona patients staff vl get infected and unknowingly the every patient which vl come in contact with vl b infected"
positive,wajid khan of the sajid wajid brothers is no more due to the corona virus how many more precious lives will this take from us grew up listening to his songs rest in peace
positive,covid 19 and the developing world
negative,no there is a ban on nearly all european nationals (passengers) from entering the united states several scheduled transatlantic flights are continuing as normal with american citizens onboard …
positive,good work
negative,my worst fear right now is my plug catches coronavirus and i smoke his coronavirus weed
positive,dealing with is not only about physical health healthy & effective public investment is also essential and is supporting through …
negative,4 hospital workers in delhi succumbed to _19india in last 3 days 1 mess worker of aiims 2 former medicine hod of aiims 3 staff nurse of kalra hospital 4 sanitation supervisor of aiims our heartfelt condolences but of _crore as proposed by u sir
negative,"where is order chennai in app it says ""completed"" i did not receive anything your call in number does not work this is my 1st experience moving away frm my regular and it is already such that i have ask status in tweeter please look into"
positive,thanks to the latest technology zoom_video_communications the budding are following their routines and keeping themselves fit even during the their wonderful coaches from… …
negative,due to the prevailing situation of covid 19 the family members of students in kashmir are worried about their health in custody the last hearing was listed on april 09 and after that no hearing has been listed for the case in court
negative,16/4/20 lockdown is not a solution 28/5/20 lockdown is not a solution back then did not listen & literally abused saying go back to italy how hard it is to accept opposition inputs on time ”their ego is costing lives”
negative,10 20am (100 to go ) this is not good it is trending too high for my prediction this graph is pure speculation for datapic twitter com/sfe4ov6nz2
negative,he is more worried about losing his muscle mass than getting coronavirus
negative,un has failed to act on covid 19 …
positive,summers here now begins my personal lockdown of 3 months
positive,although i have not met my fav actress yet but tried my best to make a small digital caricature red_heart thanks for inspiring me always hope to meet u super soon when u visit delhi after lockdown eagerly waiting to meet u smiling_face_with_heart-eyes sparkles
positive,eid mubarak hope this eid brings joy and ease for everyone stay safe from dj sam high beam auto & star white_medium_star concept events …
negative,do the other half have corona virus or have they had their accounts shut down
negative,question how did china stopped the spread of coronavirus for 3 days now america is the richest nation in d world but we are having shortage of face masks ventilators respirators & our president is passing his responsiblities to governors he blames other people for his boos
negative,ex congress corporator manjur khan pathan died because of corona virus in vadodara where he had been undergoing treatment at a private medical college since last week વડોદરા શહેર કોંગ્રેસ ના માજી કોર્પોરેટર… …
negative,disney delays mulan and new mutants over coronavirus fears
negative,stay home now coronavirus is hiding in plain sight
positive,we are looking forward
negative,herat is at the frontline of the fight against corona but unfortunately medical equipment and supplies for herat are not provided as needed if the herat crisis is not taken seriously the whole country will be in crisis _in_crisis #هرات_در_بحران
positive,of the life of prophet muhammad (pbuh) ⁣ ⁣ imam ⁣ october 20 1989⁣ ⁣ _khadija ⁣⁣
negative,please register fir against this fake doctor spreading misinformation on coronavirus and order youtube to block this account
negative,if you are feeling hungry & want to do some food take aways during this _19 season order them from your local 'gerai's avoid all unhealthy
positive,air lines offers after corona grinning_squinting_face grinning_squinting_face
negative,the best way to prevent the spread of the coronavirus is to practice basic personal hygiene although you may not be at risk of contracting this illness it is vital that you are cautious of you health to protect the immune compromised
positive,good this is the best method to tackle corona virus presently
negative,in the past couple of weeks the the kuwait government a royal princess of the as well as a no of arab activists have called out islamophobia hate speech by indian seen to be accusing the country's muslims of spreading the novel coronavirus
positive,thank you for your encouraging words your support and motivation strengthens our resolve to serve the despite the adverse circumstances /ypomtl1g9b
negative,trump and modi in their ubiqutous hubris denied covid 19 initailly making their own people more unsafe …
negative,dumb cn't calm fears bc he has zero skills lying about the pandemic is not leadership his infection of is more dangerous than anything trump wants payroll tax relief to calm virus spooked markets
negative,conspiracy theory the coronavirus was caused by the millennial fad of eating “the booty like groceries ”
negative,president trump did not make the coronavirus china did and released it to try and get president trump out of office tired of being stupid yet
negative,hitler in action turning asylum seekers away in response to coronavirus outbreak 'will endanger more lives ' rights groups warn
negative,god forbid you have tix to a concert and are not feeling well despite the coronavirus pandemic would rather you go to the concert and make everyone sick rather than refund your tix bad business
negative,fuck me sullivan will probably get corona virus on loan with option to buy
positive,kejriwal sahab spends crores if money in advertising but have no money for our corona health warriors who are 24*7 risking their lives just to save ours /skjpwef5wf
negative,people understand with your funny tone more people will understand and follow as we do not take serious thing serious so do it for us as now we will be blamed if we get corona or if we do not get vent and finally if we die as gov't does not want to do anything
negative,if you are going to ask someone where you should go get tested for coronavirus consider not walking up to them but asking from a far also do not be surprised if the person you walked up to is giving a disgusted look at you there is a reason
positive,ya girl is out clapping_hands_medium_skin_tone of clapping_hands_medium_skin_tone shape clapping_hands_medium_skin_tone & ready to be back in the gym howevaa abu dhabi was beautiful United_Arab_Emirates • • _19 dhabi united arab emirates
negative,“students will not be allowed to return to campus to gather their belongings given “rapid change of circumstances and advisement of health officials” and “for the sake of individual and broader campus safety”” duke bans students from dorms
negative,coronavirus mortgage payment worries take these steps
negative,wait they will remove all ur service request also and security guard they will not pay for water they will not send anyone for cleaning if u will call them they will say sir/mam ths is lockdown after lockdown wll arrange boss the situation is since we shifted at ur apartment
negative,this is what the news channel's need to highlight people lockdown in home's are going in depression due to the negative news of corona
negative,distracting myself as much as possible but overwhelming sadness when i when hear about the coronavirus devastated that our administration blew any chance of taking the virus head on & worried about how many innocent lives are going to be lost because of their incompetence
negative,rip sajid wajid great loss for bollywood he passed due to covid 19 heart and kidney disease 2020 is such a worst year ー19
negative,what part of ‘social distancing'/‘stay at home'/‘ ' did not these understand obviously the messaging on the has not been understood yet by large sections of india despite our pm/goi trying to explain
positive,how do you behind eligible to test your eyesight by driving 30 miles to a beauty spot on your wife's birthday during lockdown pic twitter com/lr3292kozm
positive,_ur_heroes cute angels source of for us zuhaib has been filling this coin bank for 3 years today he made his contributions to ababeel _hero this contribution has been one of the most emotional ones this ramadhan
negative,this time it is about indian economy after the covid19 pandemic pls watch comment and share …
negative,3rd death reported in j&k toll 31 the death toll due to ー19 rose to 31 in jammu and kashmir as third death was reported due to the coronavirus in on monday …
positive,youth congress and we are all proud to find a president like you sir the service work done by you throughout the lockdown is commendable which is not possible to describe in words
negative,"what would a covid 19 pandemic look like in australia ""i'm always concerned that people will think that once it is going there is nothing you can do about it but that could not be further from the truth” thanks for this insightful piece"
negative,dear i know a state of ours cannot shell out that much but it will be great if we have some financial package for all those front line staffs fighting this corona epidemic day in and day out …
negative,very sick people indeed oh not dems the victims of 45's inaction with the coronavirus he knew on jan 6 and called it a hoax for almost 2 months decisive no devisive
positive,it is good results of efforts by chandigarh administration and corona warriers /pndb0n959y
positive,thanks to for having this scientific interaction on _cov_2 _distancing …
positive,stay home stay safe stay sane …
negative,left hand anna offline boring lockdown lekunte frnds tho spend chesevaadni
negative,coronavirus a world crisis end all sanctions now china and russia call on us to lift sanctions against iran
negative,i wish things could just be ok no matter what i do something catastrophic has to destroy my progress we were doing good financially i found a temporary job and now the fucking coronavirus is putting us in the fucking hole again and threatening my life like can i have a break
negative,evening update 128 343 cases globally up about 6k us at 1 663 up about 300 the jhu site appears to be having some problems that limit other information
negative,hare krsna sir my relatives came frm bihar on 17th mar & few days later lockdown started since then they are held up here now as special trains has started i am requesting you 2 please guide how they can utilise it i am trying but not able 2 know how 2 do pls help
negative,do the cretins who pushed old ladies over in their haste to over stockpile and brushed against each other not realise that their piles of stock might outlive them
negative,we are urged by and his mates to pull together to combat the then you see the bondi debacle the cruise ship unloading in sydney and now there are rumours that gov't ministers including the pm have taken their kids out of school wtf
negative,coronavirus keeping you inside sick of your spouse want to watch some nonsense then come watch and listen to me get drunk and blunder games on my friend's stream then come on in
negative,coming from a guy who lied to congress and staged the biggest coup in our countries history to take down a president corona virus no deep state virus
negative,there are expected more than 6 lac cases in hunn dasdi pai ay na govt mukhtaryaa eid shoppings with no sops being followed by people was a success behind this
negative,the has been around since the 60s why are we all of a sudden more affected by it
positive,love is in the air but do you know that you get no air to breathe if you are involved with a toxic love ~shrey
negative,utter disgrace from the scumbag with their page one on tuesday irresponsible inaccurate scaremongering and likely to act as incentive for people to ignore twitter com/ctwxbdo43a
negative,ppl r dying in delhi due to corona n cm is having so much time to joke he has got enough time to come on tv a talk lies what an eyewash asking for ppls suggestions heartless fellow
negative,coronavirus has hit & you are quarantined with your first 5 infected everyone else hoarding all the tp bathing in hand sanitizer telling everyone it is a conspiracy booking cheap vacation to italy
positive,do not forget failure to help the people during covid19 outbreak
negative,if this was the pandemic they say it is your phone would not be getting any signal your electricity would be out the flights would be cancelled and the world would stop damn turning if the coronavirus was as big as the next plague
positive,happy anniversary to you and your husband enjoy the date
negative,question what is the government not telling us about the coronavirus
negative,shop no 168 kherwadi road bandra east found 2 corona positive patients but still nirmal nagar police and bmc failed to take preventive actions against them shop is opened and other family members are free to roam /ejv60wpvjh
negative,the greatness of indian & is even party supporters are not seen supporting for last some days after kejriwal did a biggest mistakes in the testing times of the country of nation is above the politics for all of us
negative,surprised to find 50% respondents feeling depressed ( 13 + 37) lockdown is hurting mental health …
negative,please burn corona infected dead persons in electric creeamatorium
negative,they said the coronavirus going for a three peat scary hours
negative,support is being offered for both housing and employment transition on individual basis hotlines are open vulnerable students will struggle but i'm hopeful will have options structural issues need structural solutions problem is large scale structure now confers risk
positive,asymptomatic carriers are more than 80% nobody is talking about true potential of mask usage simple can save thousands of lives if everyone wears one world leaders are letting people die of …
negative,a huge loss to the industry and the world of music as wajid khan passes away the talented singer composer lost battle to covid 19 in a mumbai hospital today rest in peace twitter com/mxrtmncxsu
negative,in europe china and north america communities r supporting each other n doctors are working day n night to find a cure n vaccine for coronavirus while arabs are cracking jokes blaming their governments partying n storing groceries #حظر_تجول_اجباري_ينقذنا
positive,initiative of is excellent in preventing …
positive,to overcome reopening challenges after cut non essential costs look for online opportunities review your b model consider new channels
positive,asymptomatic carriers are more than 80% nobody is talking about true potential of mask usage simple can save thousands of lives if everyone wears one is letting people die of …
negative,if the govt ban the incoming of foreigners when 1st case of corona detected or make compulsory quarantined them then would never be happened now playing blame game n giving corona a communal angle by the is not culprit the govt n administration is
negative,wish you had run this trend when a religious congregation was organised ignoring corona crisis and the followers believed the god will save them from corona and nothing is going to happen to them result 100s infected 100s died
negative,thanks for the question i highlighted as this has been used by politicians to justify policy (on ) for the graph the key issue is the slope the steeper the slope the more rapidly is spreading
negative,who is idea is it that the attendant has to put there hand all over our beer to open it this is how you spread
negative,localism is the right way to deal with such problems you are right initially the lockdown was to deal with it universally now the state govts have been given the freedom to handle the crisis within a broad framework too much politics is messing the issue
positive,i hope everyone happy and you too june is halfway of the year 2020 i thinkabout corona virus its farewell
negative,this is not a time for jokes but someone called the coronavirus the “wuhan waylayer” & i could not help but chuckle
positive,_effect * મારા બેટા એરપોર્ટમાં થપો રમે છે■■ playing on empty airport grinning_face_with_big_eyes grinning_face_with_big_eyes first foundation
negative,govt briefed on ✓there are 1637 confirmed cases ✓386 new cases reported ✓38 death ✓ 3 new death in last 24 hours ✓132 patient recovered ✓no of cases increased due to cases related movement /we9ftbil6b
negative,our country is facing the worst time during this pandemic back to back we are loosing great artists in the period of covid19 shocked and deeply saddened to hear the news of passing in his younger age bollywood will miss you a lot and your music rest in peace
negative,let us be honest i miss the maid – at kubera park
negative,the real problem is covid19 and ph govt is diverting it to useless case dahil na nman cguro na hurt ang ego
positive,the covid 19 contagion might be challenging our lifestyle and our work habits but it is also making us more resilient as the saying goes ‘necessity is the mother of invention' we shall see new innovative ideas and systems in all aspects of life …
negative,coronavirus threat is blown out of proportion mortality rate of coronavirus in most of the places is less than 1% one person dies every 37 seconds in the united states from cardiovascular disease about 647 000 americans die from heart disease each year that is 1 in every 4 die
positive,my first trip will be to see my only love my mother when this nightmare corona ends
negative,fears drive immigrants to sgv gun shops via
negative,it is some the government is not telling people about the corona virus
negative,historical day for chirayu family that become india's first hospital those discharge 100 patients of covid 19 health minister of india narottammishrabjp medical college & hospitals bhopal …
negative,corona is proving a bonanza for private hospitals they have announced a package of rs 6 7 lac per patient how many people can afford it when the virus is taking heavy toll will dr zafar mirza cares to address this issue of profiteering by inhuman private hoapital
positive,delhi has witnessed the biggest spike in covid 19 count as over 1 200 people tested positive for virus on sunday there is only around 9500 bed available for covid patient and delhi cm said we are 4 step ahead to corona ー19
positive,much needed therapy …
negative,too many things are happening too many things have changed too many things have stopped yes this is difficult but each of us will continue to move one small step at a time it is not a race choose your speed twitter com/n8mpwxzihv
negative,bill gates in 2015 warn of corona virus plague he says a global health system need to be seriously considered further saying investment in these programs pale in comparison w/ bio nuclear tech i think global health systems is best handled using a i technology ー19
positive,a n i g h t i n s i n g a p o r e __ thanks to covid 19 for letting me back into this one particular pleasure … …
negative,public gathering should not be promoted by media already 100k + people died in coronavirus these people want more death to happen shameful act
negative,this is the reality of coronavirus think before you go out and put others in danger
positive,scientists coronavirus can last on metal for 9 days metalheads pic twitter com/m1gtsgxghl
negative,coronavirus concerns after trump contacts with now self quarantined gop congressmen
negative,quit buying all the toilet paper you stupid fuckers you dont need so much toilet paper all of a sudden you scared bitches i swear yall are the most greedy humans in the fucking worldpic twitter com/zkdirztuuq
negative,world gone nuts lockdown over here bars/restaurants shutdown for 15 days pic twitter com/awshufsbyk
negative,nobody says “where are you ” anymore
negative,everyone selling stuff like coronavirus sale covid clearance 50% off only for a limited time offer ends with the world
negative,stop booking cheap flights to hawaii i have family on kauai they are not medically equipped to handle an outbreak if it becomes widespread on the island i do not care if you want to quarantine on a luxury vacation stay home and think of the lives you are endangering
negative,anyone else beginning to feel a little bit anxious
